id,inserted_at,message,user_id,is_ai_response
1,2025-03-01T10:15:00Z,I've been experiencing increased fatigue after my chemotherapy sessions,524b5d50-fba6-42a4-8a8b-06516a5e1e08,false
2,2025-03-01T10:15:30Z,Fatigue is a common side effect of chemotherapy. How severe is it and how long does it typically last after treatment?,524b5d50-fba6-42a4-8a8b-06516a5e1e08,true
3,2025-03-01T10:16:00Z,It lasts about 3-4 days after each session and makes it difficult to do daily activities.,524b5d50-fba6-42a4-8a8b-06516a5e1e08,false
4,2025-03-01T10:16:30Z,That's within the expected range. Let's discuss some energy conservation strategies and possible adjustments to your supportive care.,524b5d50-fba6-42a4-8a8b-06516a5e1e08,true
5,2025-03-02T14:20:00Z,I'm concerned about the bone pain I'm experiencing with my hormone therapy,6b8e0e1c-7794-4c29-87f9-1a24ef64be91,false
6,2025-03-02T14:20:30Z,Bone pain is a known side effect of hormone therapy for prostate cancer. Where is the pain located and how would you rate it on a scale of 1-10?,6b8e0e1c-7794-4c29-87f9-1a24ef64be91,true
7,2025-03-03T09:45:00Z,I'm having nausea and loss of appetite after my chemotherapy sessions,be4e5436-46f6-4988-a3c3-9d985d031aa0,false
8,2025-03-03T09:45:30Z,I understand how challenging these side effects can be. Let's discuss adjusting your anti-nausea medications and some dietary strategies that might help.,be4e5436-46f6-4988-a3c3-9d985d031aa0,true